{
  "schemaVersion": "1.0",
  "revisionId": "local-bootstrap-1",
  "languages": [
    {
      "id": "c",
      "name": "C",
      "purl": {
        "type": "generic",
        "name": "c",
        "version": "managed"
      },
      "runtimeId": "runtime-missing",
      "packageManagerId": "package-manager-c",
      "lockfileId": "lockfile-c",
      "builderId": "builder-c",
      "invariantIds": [
        "invariant-c"
      ],
      "documentationId": "docs-c"
    },
    {
      "id": "cpp",
      "name": "C++",
      "purl": {
        "type": "generic",
        "name": "cpp",
        "version": "managed"
      },
      "runtimeId": "runtime-cpp",
      "packageManagerId": "package-manager-cpp",
      "lockfileId": "lockfile-cpp",
      "builderId": "builder-cpp",
      "invariantIds": [
        "invariant-cpp"
      ],
      "documentationId": "docs-cpp"
    },
    {
      "id": "csharp",
      "name": "C#",
      "purl": {
        "type": "nuget",
        "name": "csharp",
        "version": "managed"
      },
      "runtimeId": "runtime-csharp",
      "packageManagerId": "package-manager-csharp",
      "lockfileId": "lockfile-csharp",
      "builderId": "builder-csharp",
      "invariantIds": [
        "invariant-csharp"
      ],
      "documentationId": "docs-csharp"
    },
    {
      "id": "dart",
      "name": "Dart",
      "purl": {
        "type": "pub",
        "name": "dart",
        "version": "managed"
      },
      "runtimeId": "runtime-dart",
      "packageManagerId": "package-manager-dart",
      "lockfileId": "lockfile-dart",
      "builderId": "builder-dart",
      "invariantIds": [
        "invariant-dart"
      ],
      "documentationId": "docs-dart"
    },
    {
      "id": "elixir",
      "name": "Elixir",
      "purl": {
        "type": "hex",
        "name": "elixir",
        "version": "managed"
      },
      "runtimeId": "runtime-elixir",
      "packageManagerId": "package-manager-elixir",
      "lockfileId": "lockfile-elixir",
      "builderId": "builder-elixir",
      "invariantIds": [
        "invariant-elixir"
      ],
      "documentationId": "docs-elixir"
    },
    {
      "id": "go",
      "name": "Go",
      "purl": {
        "type": "golang",
        "name": "go",
        "version": "managed"
      },
      "runtimeId": "runtime-go",
      "packageManagerId": "package-manager-go",
      "lockfileId": "lockfile-go",
      "builderId": "builder-go",
      "invariantIds": [
        "invariant-go"
      ],
      "documentationId": "docs-go"
    },
    {
      "id": "haskell",
      "name": "Haskell",
      "purl": {
        "type": "hackage",
        "name": "haskell",
        "version": "managed"
      },
      "runtimeId": "runtime-haskell",
      "packageManagerId": "package-manager-haskell",
      "lockfileId": "lockfile-haskell",
      "builderId": "builder-haskell",
      "invariantIds": [
        "invariant-haskell"
      ],
      "documentationId": "docs-haskell"
    },
    {
      "id": "java",
      "name": "Java",
      "purl": {
        "type": "maven",
        "name": "java",
        "version": "managed"
      },
      "runtimeId": "runtime-java",
      "packageManagerId": "package-manager-java",
      "lockfileId": "lockfile-java",
      "builderId": "builder-java",
      "invariantIds": [
        "invariant-java"
      ],
      "documentationId": "docs-java"
    },
    {
      "id": "javascript",
      "name": "JavaScript",
      "purl": {
        "type": "npm",
        "name": "javascript",
        "version": "managed"
      },
      "runtimeId": "runtime-javascript",
      "packageManagerId": "package-manager-javascript",
      "lockfileId": "lockfile-javascript",
      "builderId": "builder-javascript",
      "invariantIds": [
        "invariant-javascript"
      ],
      "documentationId": "docs-javascript"
    },
    {
      "id": "kotlin",
      "name": "Kotlin",
      "purl": {
        "type": "maven",
        "name": "kotlin",
        "version": "managed"
      },
      "runtimeId": "runtime-kotlin",
      "packageManagerId": "package-manager-kotlin",
      "lockfileId": "lockfile-kotlin",
      "builderId": "builder-kotlin",
      "invariantIds": [
        "invariant-kotlin"
      ],
      "documentationId": "docs-kotlin"
    },
    {
      "id": "lua",
      "name": "Lua",
      "purl": {
        "type": "generic",
        "name": "lua",
        "version": "managed"
      },
      "runtimeId": "runtime-lua",
      "packageManagerId": "package-manager-lua",
      "lockfileId": "lockfile-lua",
      "builderId": "builder-lua",
      "invariantIds": [
        "invariant-lua"
      ],
      "documentationId": "docs-lua"
    },
    {
      "id": "objective-c",
      "name": "Objective-C",
      "purl": {
        "type": "generic",
        "name": "objective-c",
        "version": "managed"
      },
      "runtimeId": "runtime-objective-c",
      "packageManagerId": "package-manager-objective-c",
      "lockfileId": "lockfile-objective-c",
      "builderId": "builder-objective-c",
      "invariantIds": [
        "invariant-objective-c"
      ],
      "documentationId": "docs-objective-c"
    },
    {
      "id": "perl",
      "name": "Perl",
      "purl": {
        "type": "cpan",
        "name": "perl",
        "version": "managed"
      },
      "runtimeId": "runtime-perl",
      "packageManagerId": "package-manager-perl",
      "lockfileId": "lockfile-perl",
      "builderId": "builder-perl",
      "invariantIds": [
        "invariant-perl"
      ],
      "documentationId": "docs-perl"
    },
    {
      "id": "php",
      "name": "PHP",
      "purl": {
        "type": "composer",
        "name": "php",
        "version": "managed"
      },
      "runtimeId": "runtime-php",
      "packageManagerId": "package-manager-php",
      "lockfileId": "lockfile-php",
      "builderId": "builder-php",
      "invariantIds": [
        "invariant-php"
      ],
      "documentationId": "docs-php"
    },
    {
      "id": "python",
      "name": "Python",
      "purl": {
        "type": "pypi",
        "name": "python",
        "version": "managed"
      },
      "runtimeId": "runtime-python",
      "packageManagerId": "package-manager-python",
      "lockfileId": "lockfile-python",
      "builderId": "builder-python",
      "invariantIds": [
        "invariant-python"
      ],
      "documentationId": "docs-python"
    },
    {
      "id": "r",
      "name": "R",
      "purl": {
        "type": "cran",
        "name": "r",
        "version": "managed"
      },
      "runtimeId": "runtime-r",
      "packageManagerId": "package-manager-r",
      "lockfileId": "lockfile-r",
      "builderId": "builder-r",
      "invariantIds": [
        "invariant-r"
      ],
      "documentationId": "docs-r"
    },
    {
      "id": "ruby",
      "name": "Ruby",
      "purl": {
        "type": "gem",
        "name": "ruby",
        "version": "managed"
      },
      "runtimeId": "runtime-ruby",
      "packageManagerId": "package-manager-ruby",
      "lockfileId": "lockfile-ruby",
      "builderId": "builder-ruby",
      "invariantIds": [
        "invariant-ruby"
      ],
      "documentationId": "docs-ruby"
    },
    {
      "id": "rust",
      "name": "Rust",
      "purl": {
        "type": "cargo",
        "name": "rust",
        "version": "managed"
      },
      "runtimeId": "runtime-rust",
      "packageManagerId": "package-manager-rust",
      "lockfileId": "lockfile-rust",
      "builderId": "builder-rust",
      "invariantIds": [
        "invariant-rust"
      ],
      "documentationId": "docs-rust"
    },
    {
      "id": "scala",
      "name": "Scala",
      "purl": {
        "type": "maven",
        "name": "scala",
        "version": "managed"
      },
      "runtimeId": "runtime-scala",
      "packageManagerId": "package-manager-scala",
      "lockfileId": "lockfile-scala",
      "builderId": "builder-scala",
      "invariantIds": [
        "invariant-scala"
      ],
      "documentationId": "docs-scala"
    },
    {
      "id": "swift",
      "name": "Swift",
      "purl": {
        "type": "generic",
        "name": "swift",
        "version": "managed"
      },
      "runtimeId": "runtime-swift",
      "packageManagerId": "package-manager-swift",
      "lockfileId": "lockfile-swift",
      "builderId": "builder-swift",
      "invariantIds": [
        "invariant-swift"
      ],
      "documentationId": "docs-swift"
    },
    {
      "id": "typescript",
      "name": "TypeScript",
      "purl": {
        "type": "npm",
        "name": "typescript",
        "version": "managed"
      },
      "runtimeId": "runtime-typescript",
      "packageManagerId": "package-manager-typescript",
      "lockfileId": "lockfile-typescript",
      "builderId": "builder-typescript",
      "invariantIds": [
        "invariant-typescript"
      ],
      "documentationId": "docs-typescript"
    },
    {
      "id": "zig",
      "name": "Zig",
      "purl": {
        "type": "generic",
        "name": "zig",
        "version": "managed"
      },
      "runtimeId": "runtime-zig",
      "packageManagerId": "package-manager-zig",
      "lockfileId": "lockfile-zig",
      "builderId": "builder-zig",
      "invariantIds": [
        "invariant-zig"
      ],
      "documentationId": "docs-zig"
    },
    {
      "id": "shell",
      "name": "Shell",
      "purl": {
        "type": "generic",
        "name": "shell",
        "version": "managed"
      },
      "runtimeId": "runtime-shell",
      "packageManagerId": "package-manager-shell",
      "lockfileId": "lockfile-shell",
      "builderId": "builder-shell",
      "invariantIds": [
        "invariant-shell"
      ],
      "documentationId": "docs-shell"
    },
    {
      "id": "powershell",
      "name": "PowerShell",
      "purl": {
        "type": "nuget",
        "name": "powershell",
        "version": "managed"
      },
      "runtimeId": "runtime-powershell",
      "packageManagerId": "package-manager-powershell",